Review,lowercased,urls_removed,html_removed,emojis_removed,slangs_replaced,contractions_replaced,punctuations_removed,numbers_removed,spelling_corrected,stopwords_removed,stemmed_words,lemmatized
"The product arrived on time. Packaging was great, and the quality is amazing!","the product arrived on time. packaging was great, and the quality is amazing!","the product arrived on time. packaging was great, and the quality is amazing!","the product arrived on time. packaging was great, and the quality is amazing!","the product arrived on time. packaging was great, and the quality is amazing!","the product arrived on time. packaging was great, and the quality is amazing!","the product arrived on time. packaging was great, and the quality is amazing!",the product arrived on time packaging was great and the quality is amazing,the product arrived on time packaging was great and the quality is amazing,the product arrived on time packaging was great and the quality is amazing,product,product,product
THIS PRODUCT IS JUST AMAZING! I LOVE IT.,this product is just amazing! i love it.,this product is just amazing! i love it.,this product is just amazing! i love it.,this product is just amazing! i love it.,this product is just amazing! i love it.,this product is just amazing! i love it.,this product is just amazing i love it,this product is just amazing i love it,this product is just amazing i love it,product,product,product
"I bought this phone for $799, and it has a 120Hz display. Totally worth it!","i bought this phone for $799, and it has a 120hz display. totally worth it!","i bought this phone for $799, and it has a 120hz display. totally worth it!","i bought this phone for $799, and it has a 120hz display. totally worth it!","i bought this phone for $799, and it has a 120hz display. totally worth it!","i bought this phone for $799, and it has a 120hz display. totally worth it!","i bought this phone for $799, and it has a 120hz display. totally worth it!",i bought this phone for 799 and it has a 120hz display totally worth it,i bought this phone for  and it has a hz display totally worth it,i bought this phone for  and it has a hz display totally worth it,bought,bought,bought
Wow!!! This product is awesome... but a bit expensive??,wow!!! this product is awesome... but a bit expensive??,wow!!! this product is awesome... but a bit expensive??,wow!!! this product is awesome... but a bit expensive??,wow!!! this product is awesome... but a bit expensive??,wow!!! this product is awesome... but a bit expensive??,wow!!! this product is awesome... but a bit expensive??,wow this product is awesome but a bit expensive,wow this product is awesome but a bit expensive,wow this product is awesome but a bit expensive,wow,wow,wow
   The laptop works perfectly fine.   ,   the laptop works perfectly fine.   ,   the laptop works perfectly fine.   ,   the laptop works perfectly fine.   ,   the laptop works perfectly fine.   ,   the laptop works perfectly fine.   ,   the laptop works perfectly fine.   ,   the laptop works perfectly fine   ,   the laptop works perfectly fine   ,   the laptop works perfectly fine   ,laptop,laptop,laptop
Check out the full product details here: https://example.com/product-details,check out the full product details here: https://example.com/product-details,check out the full product details here: ,check out the full product details here: ,check out the full product details here: ,check out the full product details here: ,check out the full product details here: ,check out the full product details here ,check out the full product details here ,check out the full product details here ,check,check,check
<div><h2>Great Purchase!</h2><p>I am happy with this product.</p></div>,<div><h2>great purchase!</h2><p>i am happy with this product.</p></div>,<div><h2>great purchase!</h2><p>i am happy with this product.</p></div>,great purchase!i am happy with this product.,great purchase!i am happy with this product.,great purchase!i am happy with this product.,great purchase!i am happy with this product.,great purchasei am happy with this product,great purchasei am happy with this product,great purchased am happy with this product,great,great,great
"The battry life is excelent, but the chargin cable is too short.","the battry life is excelent, but the chargin cable is too short.","the battry life is excelent, but the chargin cable is too short.","the battry life is excelent, but the chargin cable is too short.","the battry life is excelent, but the chargin cable is too short.","the battry life is excelent, but the chargin cable is too short.","the battry life is excelent, but the chargin cable is too short.",the battry life is excelent but the chargin cable is too short,the battry life is excelent but the chargin cable is too short,the battery life is excellent but the charging cable is too short,battery,batteri,battery
I can't believe it's so good! Didn't expect such quality.,i can't believe it's so good! didn't expect such quality.,i can't believe it's so good! didn't expect such quality.,i can't believe it's so good! didn't expect such quality.,i can't believe it's so good! didn't expect such quality.,i can't believe it's so good! didn't expect such quality.,i cannot believe it is so good! did not expect such quality.,i cannot believe it is so good did not expect such quality,i cannot believe it is so good did not expect such quality,i cannot believe it is so good did not expect such quality,cannot,cannot,can not
"Love this product! ???? Fast delivery ??, amazing quality! ??","love this product! ???? fast delivery ??, amazing quality! ??","love this product! ???? fast delivery ??, amazing quality! ??","love this product! ???? fast delivery ??, amazing quality! ??","love this product! ???? fast delivery ??, amazing quality! ??","love this product! ???? fast delivery ??, amazing quality! ??","love this product! ???? fast delivery ??, amazing quality! ??",love this product  fast delivery  amazing quality ,love this product  fast delivery  amazing quality ,love this product  fast delivery  amazing quality ,love,love,love
"TBH, I wasn't expecting much, but OMG, this is awesome!!","tbh, i wasn't expecting much, but omg, this is awesome!!","tbh, i wasn't expecting much, but omg, this is awesome!!","tbh, i wasn't expecting much, but omg, this is awesome!!","tbh, i wasn't expecting much, but omg, this is awesome!!","to be honest, i wasn't expecting much, but oh my god, this is awesome!!","to be honest, i was not expecting much, but oh my god, this is awesome!!",to be honest i was not expecting much but oh my god this is awesome,to be honest i was not expecting much but oh my god this is awesome,to be honest i was not expecting much but oh my god this is awesome,honest,honest,honest
This is the best product I have ever used in my life!,this is the best product i have ever used in my life!,this is the best product i have ever used in my life!,this is the best product i have ever used in my life!,this is the best product i have ever used in my life!,this is the best product i have ever used in my life!,this is the best product i have ever used in my life!,this is the best product i have ever used in my life,this is the best product i have ever used in my life,this is the best product i have ever used in my life,best,best,best
"The shoes were comfortable, fitting nicely, and worked perfectly for jogging.","the shoes were comfortable, fitting nicely, and worked perfectly for jogging.","the shoes were comfortable, fitting nicely, and worked perfectly for jogging.","the shoes were comfortable, fitting nicely, and worked perfectly for jogging.","the shoes were comfortable, fitting nicely, and worked perfectly for jogging.","the shoes were comfortable, fitting nicely, and worked perfectly for jogging.","the shoes were comfortable, fitting nicely, and worked perfectly for jogging.",the shoes were comfortable fitting nicely and worked perfectly for jogging,the shoes were comfortable fitting nicely and worked perfectly for jogging,the shoes were comfortable fitting nicely and worked perfectly for jogging,shoes,shoe,shoe
